{
  "description": "A complete Level 4 guide with a matching sidecar manifest and DNS TXT-style independent anchor.",
  "evaluation_mode": "local-file",
  "achieved_level": 4,
  "guide_sha256": "720c8933dc0684220e8d75a145f84b56591e67f16847a48b626f9de4991acfd1",
  "guide_bytes": 3367,
  "blocking_finding_ids": [],
  "required_warning_ids": [],
  "level5_ready": true
}
